tweet_id,time_created,url,username,text,likes,replies,retweets
1798631885977088252,2024-06-06 08:23:53+00:00,https://x.com/UGM_FESS/status/1798631885977088252,UGM_FESS,"Aloo gais, ayo ramein Kewirausahaan EXPO di faperta yujiem besok siang bangett â€¼ï¸â€¼ï¸
Banyak stand makanan dan minuman menarik lho ðŸ¤¤ðŸ¤¤
Ditunggu di auditorium Hardjonodanoesastro yaaa ðŸ‘‹ðŸ‘‹ https://t.co/CGgghoW7oM",113,14,10
1798630057365422418,2024-06-06 08:16:37+00:00,https://x.com/UGM_FESS/status/1798630057365422418,UGM_FESS,"ugm_fess Untuk Aya dan Karin PSdK 21 makasih udah peduli sama akuuu ya, aku bersyukur ketemu orang sebaik kalian ðŸ’–",3,0,0
1798628461990518926,2024-06-06 08:10:16+00:00,https://x.com/UGM_FESS/status/1798628461990518926,UGM_FESS,"ugm_fess

""woke up looking like this""",0,1,0
1798625806299852995,2024-06-06 07:59:43+00:00,https://x.com/UGM_FESS/status/1798625806299852995,UGM_FESS,"kenapa ya D*KM ga langsung bilang aja range dana buat tim kkn berapa gitu, meresahkan ya yujiem",0,0,0
1798625534219575325,2024-06-06 07:58:38+00:00,https://x.com/UGM_FESS/status/1798625534219575325,UGM_FESS,neken spending sehari 12k susah bgt ternyata ðŸ˜“ ugm_fess,0,0,0
1798624289979314619,2024-06-06 07:53:42+00:00,https://x.com/UGM_FESS/status/1798624289979314619,UGM_FESS,"NGE-DATE DI UGMðŸ™€ðŸ’žâ‰ï¸

Masa nolak pameran &amp; konser date?ðŸ˜‹
Festagama 12.0 bakal adain acara pameran â€˜Pentas Kotaâ€™ plus closing â€˜Sorak Kotaâ€™ nihhðŸ™€ Buruan dateng ajak pacar atau gebetan kalian, tanggal 8-9 Juni besokâ€¼ï¸
ugm_fess https://t.co/RygWZDEle5",2,1,0
1798623910176641366,2024-06-06 07:52:11+00:00,https://x.com/UGM_FESS/status/1798623910176641366,UGM_FESS,Yujiem! MENURUT KALIANNN beli panci listrik itu worth/ga?,1,2,0
1798620065354686927,2024-06-06 07:36:54+00:00,https://x.com/UGM_FESS/status/1798620065354686927,UGM_FESS,ugm_fess guys di FEB ada Chatime sama Subway?? Yukkk ke FEB!!!! https://t.co/D9wxErTDs4,127,24,5
1798623561390981314,2024-06-06 07:50:48+00:00,https://x.com/UGM_FESS/status/1798623561390981314,UGM_FESS,"ugm_fess guyss, disini ada yg rencana langganan  chatgpt plus gk yaa? kalau ada ayoo sharing!! rep yaa",0,1,0
1798623338665054636,2024-06-06 07:49:55+00:00,https://x.com/UGM_FESS/status/1798623338665054636,UGM_FESS,ugm_fess Guys ada yang pernah sembelit/konstipasi sampe pinggangnya nyeri ga sih? Ini tuh emang normal kah?,0,0,0
1798622432791806113,2024-06-06 07:46:19+00:00,https://x.com/UGM_FESS/status/1798622432791806113,UGM_FESS,pandu iup kimia 23 single gak luv,0,0,0
1798619402558144843,2024-06-06 07:34:16+00:00,https://x.com/UGM_FESS/status/1798619402558144843,UGM_FESS,"ugm_fess ikutan tebak prodi â€¼ï¸

gunting tempel kertas, psikologi, mainan origami &amp; plastisin, hukum, menggambar dan mewarnai, akuntansi, macam"" tanaman, manajemen, fisika, mekanika, budaya dan sejarah, ilmu tanah, estetika dan proporsi, rekayasa

prodi apakah yang dimaksud?",0,2,0
1798619367430926717,2024-06-06 07:34:08+00:00,https://x.com/UGM_FESS/status/1798619367430926717,UGM_FESS,"yujiem guys ada yg iphonenya pernah ilang sinyal ga guys?? padahal beli di ibox kok bukan inter tp kok bsa ilang yaa, udh coba restart mode pesawat sama aja, info dong guys sender klo keluar ky org dongo gabisa main hp",1,2,0
1798618983639531977,2024-06-06 07:32:37+00:00,https://x.com/UGM_FESS/status/1798618983639531977,UGM_FESS,Yujiem! Hari minggu kalian gabut?? GASS YUU IKUT PALAWA AJAA DIJAMIN SERU BGT ðŸ˜ðŸ˜ https://t.co/YK8HKpFAiT,0,0,4
1798618915314282935,2024-06-06 07:32:20+00:00,https://x.com/UGM_FESS/status/1798618915314282935,UGM_FESS,Ada yang bisa bikin prototype website? Deadline nya maksimal hari selasa. Ini cuman buat prototype aja ga buat website nya. Mohon infonya yaa yujiem,0,0,0
1798618435158786499,2024-06-06 07:30:26+00:00,https://x.com/UGM_FESS/status/1798618435158786499,UGM_FESS,Yujiem! Kalian yg pake smartfren juga ilang ga sinyalnya?,0,2,0
1798617299286650894,2024-06-06 07:25:55+00:00,https://x.com/UGM_FESS/status/1798617299286650894,UGM_FESS,ugm_fess biasanya anak ugm nyemilnya apaan si,0,6,0
1798615849911345465,2024-06-06 07:20:09+00:00,https://x.com/UGM_FESS/status/1798615849911345465,UGM_FESS,"halo yujiem, sekiranya ada yg membutuhkan bisa langsung daftar pada link yg tertera ya. tenang aja seluruh prosesnya akan didampingi oleh psikolog &amp; art-therapist dan dijamin kerahasiaannya. kami membutuhkan 1 orang lagi untuk bergabung, let's heal together!ðŸ’œðŸ©· https://t.co/jqefGCNxam",11,0,4
1798613893373407290,2024-06-06 07:12:23+00:00,https://x.com/UGM_FESS/status/1798613893373407290,UGM_FESS,"halo guys, aku lagi open order ganci nihh ðŸ’µ https://t.co/2oHk1lHJZx",10,1,1
1798612617919123877,2024-06-06 07:07:19+00:00,https://x.com/UGM_FESS/status/1798612617919123877,UGM_FESS,kasi aku tutor nangis tanpa keluar ingus dong warga yujiem malu bgt tiap nangis ingusku melebar kemana mana,0,0,0
1798611840211304658,2024-06-06 07:04:13+00:00,https://x.com/UGM_FESS/status/1798611840211304658,UGM_FESS,ugm_fess gimana keadaan progres tim KKN kalian? Apakah aman?,0,1,0
1798607370832187592,2024-06-06 06:46:28+00:00,https://x.com/UGM_FESS/status/1798607370832187592,UGM_FESS,"yujiem, curhat dong.. sender ngerasa insecure bangett karena sender kuruss
berat sender cuma 37 dan susah banget naiknya, sender udah coba makan yg banyak terus istirahat yg cukup tapi tetep aja mentok cuma di 39:( sometimes sender merasa malu dan ga pd",0,2,0
1798607122051338630,2024-06-06 06:45:29+00:00,https://x.com/UGM_FESS/status/1798607122051338630,UGM_FESS,yujiem! JANGAN LUPA AMANAIN VOUCHER GRAB DINE IN ðŸŒ https://t.co/UAgoBFYDE1,1,0,0
1798606790780965339,2024-06-06 06:44:10+00:00,https://x.com/UGM_FESS/status/1798606790780965339,UGM_FESS,"ada blink gak disini??? ada yang mau beli photocard blackpink gak, yang oreo, the album, atau bornpink. BU bangetðŸ˜­ðŸ˜­ yujiem!",0,0,0
1798606040793280996,2024-06-06 06:41:11+00:00,https://x.com/UGM_FESS/status/1798606040793280996,UGM_FESS,"Adakah yang tinggal di padukuhan kayen, concat, dan punya nomor pak dukuhnya? Pliss bantu yujiem",1,0,0
1798605715646697765,2024-06-06 06:39:53+00:00,https://x.com/UGM_FESS/status/1798605715646697765,UGM_FESS,"temen-temen yujiem tolong bantu kami buat ngisi survei dong butuh 50 orangðŸ˜“
kriterianya berusia 18-27 tahun dan sedang kerja/magang/part time di sektor retail. thank u https://t.co/5mkOWozPiS",2,0,1
1798602431221350413,2024-06-06 06:26:50+00:00,https://x.com/UGM_FESS/status/1798602431221350413,UGM_FESS,ugm_fess sorry bukan pengepul tapi pendaki,0,0,0
1798600086311870847,2024-06-06 06:17:31+00:00,https://x.com/UGM_FESS/status/1798600086311870847,UGM_FESS,"ugm_fess tebak prodi â€¼ï¸

ekonomi manajemen akuntasi ada, keuangan ada, statistika ada, teksip ada, SIG ada, ngukur tanah ada, hukum ada, perpajakan ada, pengepul rongsokan ada, nipu makelar tanah dan rumah ada

prodi apakah yang dimaksud?",126,33,21
1798601154483617902,2024-06-06 06:21:46+00:00,https://x.com/UGM_FESS/status/1798601154483617902,UGM_FESS,"clue tambahan, biasanya punya kontak wa 2 bukan buat selingkuh tapi buat ngechat makelar ugm_fess",6,0,6
1798600218839289949,2024-06-06 06:18:03+00:00,https://x.com/UGM_FESS/status/1798600218839289949,UGM_FESS,"ugm_fess akhirnya setelah hampir 10 semester, sender besok akan sidang akhir ðŸ¥º
mohon doanya agar sidang skripsi sender lancar sampai selesai ya guys! thank u so much ðŸ’—",15,2,0
1798599798762995768,2024-06-06 06:16:23+00:00,https://x.com/UGM_FESS/status/1798599798762995768,UGM_FESS,"Warga Ugm_fess khususnya yang berada di Pogung, (Pogung Kidul). Apalagi ciwi2 yang sering ke macha ti. Tolong dong kalo nemuin kucing ini kabarin nomor terkait yaaa pliss ðŸ™ðŸ™ðŸ™ðŸ™ https://t.co/hFjRwXdrDu",41,1,21
1798599032824340507,2024-06-06 06:13:20+00:00,https://x.com/UGM_FESS/status/1798599032824340507,UGM_FESS,"sihðŸ˜­ðŸ˜­ standar harga fotocopy emang beda"" kah? 
Dan tolong sarankan sender tempat fotocopy yang murah di sekitar ugm_fess",0,0,0
1798599031599640877,2024-06-06 06:13:20+00:00,https://x.com/UGM_FESS/status/1798599031599640877,UGM_FESS,"Sender biasa fotocopy warna untuk selembar harganya 1,5k-2k. Hari ini dapat yang 2k selembarnya dengan warna ya relatif sama. terus sender cerita ke teman sender dan kata dia 2k untuk selembar itu kemahalan, berarti selama ini sender kena tipu kah?? Apa gimana  (cont..)",0,1,0
1798598663578775892,2024-06-06 06:11:52+00:00,https://x.com/UGM_FESS/status/1798598663578775892,UGM_FESS,"guyss, ada yang mau isi kuesioner kami?? butuh laki-laki berusia 17â€“30 tahun yang aktif main X aja, kokk.
rep yaa nanti aku baless, makasihh!!ðŸ«¶ðŸ«¶ ugm_fess",0,4,0
1798597393300263375,2024-06-06 06:06:49+00:00,https://x.com/UGM_FESS/status/1798597393300263375,UGM_FESS,yujiem. aku ada motor mio kaya gini nder. bekas pemakaian selama kuliah 4 tahun. masi aman kalo dipakee pergi jauh juga. surat lengkap. buka harga 6 xx boleh nego banget https://t.co/xwz9fhNavO,0,1,0
1798590379295723783,2024-06-06 05:38:57+00:00,https://x.com/UGM_FESS/status/1798590379295723783,UGM_FESS,"Halo kakak-kakak, aku butuh motor, bekas gapapa, buat bolak balik kampus, ada yg tau ga enaknya beli dimana ya yg amanah? Atau ada kakak kakak yg udah mau lulus dan motornya mau dijual, Yujiem",4,1,1
1798597344159801516,2024-06-06 06:06:37+00:00,https://x.com/UGM_FESS/status/1798597344159801516,UGM_FESS,"Ugm_fess adakah yang mau ikut aku nonton haikyuu malem ini jam 9.25? Tiketnya 35k aja yaa, ada 2 tiket!!! Yang mau rep aja yaaa, thank you^^ https://t.co/ZcD4zQUYJ6",0,2,2
1798597275859800550,2024-06-06 06:06:21+00:00,https://x.com/UGM_FESS/status/1798597275859800550,UGM_FESS,"Yuhuuuu FIB makan gratis sefakultas dulu nihh guyssss, pap kalian ngambil apa ajaaa? ðŸ˜‹ðŸ˜‹ Ugm_fess https://t.co/ezRToV1gKA",993,121,40
1798596921826955651,2024-06-06 06:04:57+00:00,https://x.com/UGM_FESS/status/1798596921826955651,UGM_FESS,inpo pom yang ada pertalite nyaa yujiem,0,0,0
1798596216512815406,2024-06-06 06:02:08+00:00,https://x.com/UGM_FESS/status/1798596216512815406,UGM_FESS,"Ugm_fess yang periode dua, jujur kalian ngerasa udah siap Ka Ka eN belum?",0,6,0
1798593955866775862,2024-06-06 05:53:09+00:00,https://x.com/UGM_FESS/status/1798593955866775862,UGM_FESS,ugm_fess info dong Laundry yg nyucinya bener area klebengan,0,0,0
1798593664559808784,2024-06-06 05:52:00+00:00,https://x.com/UGM_FESS/status/1798593664559808784,UGM_FESS,"Kulak! Siapa tau ada yg minat tiket haikyuu cgv pakuwon jogja. Masih bisa dinego lagi
Makasih gess https://t.co/BrRjzuMqr2",0,0,1
1798591352974061675,2024-06-06 05:42:49+00:00,https://x.com/UGM_FESS/status/1798591352974061675,UGM_FESS,boleh tanya tanya dulu ga nder? ugm_fess,0,0,0
1793895591984111794,2024-05-24 06:43:32+00:00,https://x.com/UGM_FESS/status/1793895591984111794,UGM_FESS,"Gaes yujiem ada yang minat sama Canon Eos M3 ku ga ya? Aman semuanya cuman minus box doang

Buka di angka 3.5",0,0,0
1798590531578245526,2024-06-06 05:39:33+00:00,https://x.com/UGM_FESS/status/1798590531578245526,UGM_FESS,ugm_fess Mama sender skizofrenia. Dulu sender punya mantan toxic banget sampe aku harus ke psikolog+sakit2an.. sekarang pacar sender selalu dikira mantan sender yg toxic ituðŸ˜­,0,0,0
1798589570952655332,2024-06-06 05:35:44+00:00,https://x.com/UGM_FESS/status/1798589570952655332,UGM_FESS,"cara ngosongin back up dari google photos gimana yaa, kalo dihapus di google photos di galeri ga kehapus kan? ugm_fess",0,0,0
1798589428899905623,2024-06-06 05:35:10+00:00,https://x.com/UGM_FESS/status/1798589428899905623,UGM_FESS,aku pikir kuliah di ugm_fess isinya nenteng-nenteng totebag dan laptop trus pulang dijemput mas pacar dari fakultas sebelah ternyata itu semua hanya khayalanku pas SMA aja alias INI KULIAH NGAPA GENRENYA ROMUSHA YA MUMET TUGAS NANGIS DAN GAADA ROMANCENYA SAMSEKðŸ˜­ðŸ˜­ðŸ˜­,1586,65,301
1798588672742408700,2024-06-06 05:32:10+00:00,https://x.com/UGM_FESS/status/1798588672742408700,UGM_FESS,"yujiem kakaku sempro besok, beliin apa ya:( yg murah tapi tetep keliatan oke atau bucket bunga yg murah dimana ya",1,2,0
1798587221995606067,2024-06-06 05:26:24+00:00,https://x.com/UGM_FESS/status/1798587221995606067,UGM_FESS,yujiem yaopo iki urip isine mung ngelaprak,1,0,0
1798586267124552076,2024-06-06 05:22:36+00:00,https://x.com/UGM_FESS/status/1798586267124552076,UGM_FESS,ada yang ngekos disini gak yaa? kalo ada tolong reply yujiem https://t.co/SOSrXYlwth,1,1,0
1798584111789170916,2024-06-06 05:14:02+00:00,https://x.com/UGM_FESS/status/1798584111789170916,UGM_FESS,"mengerjakan tugas apalagi mendekati kkn harus mengolah data menggunakan statistik di laptop. Kalau tidak ada, apa mending sender hutang di soppey pay later  untuk membeli laptop murah? :((",12,2,0
1798584110568657101,2024-06-06 05:14:02+00:00,https://x.com/UGM_FESS/status/1798584110568657101,UGM_FESS,ugm_fess apakah tidak ada peminjaman laptop gratis di UGM? Sender bingung duid KIP selama ini habis buat bayar kontrakan orang tua dan menuhi kebutuhan keluarga. Tapi sender bener2 butuh laptop karena sender selama ini memakai hp dan meminjam di perpustakaan untuk  (cont..),79,34,1
1798583458354340099,2024-06-06 05:11:27+00:00,https://x.com/UGM_FESS/status/1798583458354340099,UGM_FESS,saranin tempat beli baju lucu-lucu yang deket dong yujiem!,0,0,0
1798583222789681359,2024-06-06 05:10:31+00:00,https://x.com/UGM_FESS/status/1798583222789681359,UGM_FESS,"ada komunitas pokemon gk si di yujiem, khususnya player pokemon go. mau gabung dong kalau ada",0,1,0
1798582909894553854,2024-06-06 05:09:16+00:00,https://x.com/UGM_FESS/status/1798582909894553854,UGM_FESS,"yujiem 3 hari yang lalu aku dpt telpon dr stranger ngakunya orang marketplace, katanya mau kirim hadiah. Dia juga tau alamat rumahku yang lama. Ternyata paketnya beneran dikirim. Skrng aku bingung harus digimanain paketnyaðŸ˜­ Ada yang pernah ngalamin hal serupa gaa? takut bgttt",0,0,0
1798581794511679630,2024-06-06 05:04:50+00:00,https://x.com/UGM_FESS/status/1798581794511679630,UGM_FESS,yujiem! GAIS INFO APLIKASI YG BISA DESIGN RUANGAN 3D PLS PLS PLS,2,6,0
1798579955670102245,2024-06-06 04:57:32+00:00,https://x.com/UGM_FESS/status/1798579955670102245,UGM_FESS,ugm_fess ada yg tau rekomen jual hp second di jogja ga?? sender hpnya samsung series M,0,1,0
1798579294777868342,2024-06-06 04:54:54+00:00,https://x.com/UGM_FESS/status/1798579294777868342,UGM_FESS,"yujiem urgent banget buat kado, jadi mau up ayo saranin sender",1,0,0
1796503486785565031,2024-05-31 11:26:23+00:00,https://x.com/UGM_FESS/status/1796503486785565031,UGM_FESS,yujiem offline store yang banyak knitwear buat cowo dimana ya?,0,0,0
1798578473415696570,2024-06-06 04:51:38+00:00,https://x.com/UGM_FESS/status/1798578473415696570,UGM_FESS,"Ugm_fess di kelas ada 2 org pdkt dan sender duduk di belakangnya, cringe bgt tolonggggg ðŸ˜‘",0,0,0
1798577467269194163,2024-06-06 04:47:38+00:00,https://x.com/UGM_FESS/status/1798577467269194163,UGM_FESS,"Temen temen ada yang punya wa ditmawa enggak ya 
Ugm_Fess",0,1,0
1798577283508400270,2024-06-06 04:46:54+00:00,https://x.com/UGM_FESS/status/1798577283508400270,UGM_FESS,ugm_fess Halo guys. Barangkali ada yang mau jastip produk Ellips ini. Bisa COD area UGM dan Karanggayam yaa. Reply ajaa nanti aku DM! https://t.co/yb1L8jdOeF,0,0,0
1798577256690073883,2024-06-06 04:46:48+00:00,https://x.com/UGM_FESS/status/1798577256690073883,UGM_FESS,Info nobar sekitar pogung yujiem!,0,0,0
1798576986660765914,2024-06-06 04:45:44+00:00,https://x.com/UGM_FESS/status/1798576986660765914,UGM_FESS,"Permisi teman-teman, adakah yg memiliki keluhan perikoronitis seperti gambar diatas dan ingin dilakuakn perawatan dengan koas gigi? Boleh rep yaa nanti aku dmðŸ˜ Terima kasih banyak

ugm_fess https://t.co/p9plEnrc4d",7,19,1
1798576694837776388,2024-06-06 04:44:34+00:00,https://x.com/UGM_FESS/status/1798576694837776388,UGM_FESS,ada yang punya rekomen makanan berat selain olive buat konsummm? buget 10k yujiem ðŸ˜­ðŸ˜­,0,5,0
1798576689209118868,2024-06-06 04:44:33+00:00,https://x.com/UGM_FESS/status/1798576689209118868,UGM_FESS,"yujiem sender takut banget dapet nilai b/c, tips dong yang pernah depet nilai itu biar legowoðŸ˜”",0,0,0
1798573973007224861,2024-06-06 04:33:45+00:00,https://x.com/UGM_FESS/status/1798573973007224861,UGM_FESS,Ugm_fess untuk syarat yudisium mending ikut AcEPT atau TOEFL guys? Lebih mudah yang mana? ðŸ˜„,0,2,0
1798573255835681249,2024-06-06 04:30:54+00:00,https://x.com/UGM_FESS/status/1798573255835681249,UGM_FESS,gais kalo mau scaling gigi di gmc tuh bisa gak ya? yujiem,2,1,0
1798572705270423818,2024-06-06 04:28:43+00:00,https://x.com/UGM_FESS/status/1798572705270423818,UGM_FESS,ugm_fess ada yg tahu komunitas di jogja apa aja? pengenn joinn,2,0,0
1798571548380659851,2024-06-06 04:24:07+00:00,https://x.com/UGM_FESS/status/1798571548380659851,UGM_FESS,"kulak! gais, ada yg minat vakum bag+pompanya gaaa (mungkin buat yg kkn or anything). Harganya bakal lebih miring (apalagi take all). Komen yaa nnti aku ketuk dm-nya https://t.co/ElYpo9500p",6,4,0
1798571534921203884,2024-06-06 04:24:04+00:00,https://x.com/UGM_FESS/status/1798571534921203884,UGM_FESS,"permisi nitip kulak! yaa yujiem
ada skincare korea anua &amp; be the skin, ada juga parfum zara man. harga yg di foto harga lewat syop1 yaa, kalo cod aku murahin lagi. besok jumat bisa cod di sv â˜ï¸ https://t.co/JJrFEsbcww",1,0,0
1798571107035095322,2024-06-06 04:22:22+00:00,https://x.com/UGM_FESS/status/1798571107035095322,UGM_FESS,infoo panitia kurban di yujiem dong,2,0,0
1798569933284245833,2024-06-06 04:17:42+00:00,https://x.com/UGM_FESS/status/1798569933284245833,UGM_FESS,"guys, di ugm_fess ada yg open jasa delivery order ga sii? beli online mahal bgt ongkirnya :/",0,2,0
1798567549850058901,2024-06-06 04:08:14+00:00,https://x.com/UGM_FESS/status/1798567549850058901,UGM_FESS,"ugm_fess absen yg kormanitnya udah tumbang sakit tapi masih trabas demi ngurus tim, kormanit sender salah satunya semangat bu kormanit tercinta aku :""D",0,0,0
1798566988652200107,2024-06-06 04:06:00+00:00,https://x.com/UGM_FESS/status/1798566988652200107,UGM_FESS,"kalau sender buka jasa antar jemput di lingkungan yujiem ada yg maukahh? nanti bayar seikhlasnya hehe, sender cowo",2,0,0
1798564824470978637,2024-06-06 03:57:24+00:00,https://x.com/UGM_FESS/status/1798564824470978637,UGM_FESS,Tempat beli alat lab murah dimana yaa? yang deket yujiem aja plis,1,3,0
1798564629708472669,2024-06-06 03:56:38+00:00,https://x.com/UGM_FESS/status/1798564629708472669,UGM_FESS,yujiem gais ada yg mau sharing tentang organisasi kalian yang sepi terus mulai bangkit kembali ga? aku sedih organisasiku sepi tapi aku gatau mau evaluasi sama siapa huhu,4,2,0
1798562530413146489,2024-06-06 03:48:17+00:00,https://x.com/UGM_FESS/status/1798562530413146489,UGM_FESS,Yujiem... Ada yg bisa benerin file word corrupt ga ?,0,1,0
1798562302926676440,2024-06-06 03:47:23+00:00,https://x.com/UGM_FESS/status/1798562302926676440,UGM_FESS,"yujiem sender KKN di sulawesi, bawa selimut tipis dan 1 jaket penting ga yaa?",0,1,0
1798562033224614269,2024-06-06 03:46:19+00:00,https://x.com/UGM_FESS/status/1798562033224614269,UGM_FESS,ugm_fess info pukiss yg masih bukaa jam segini dimana yaaa?,0,0,0
1798561929138680132,2024-06-06 03:45:54+00:00,https://x.com/UGM_FESS/status/1798561929138680132,UGM_FESS,siapa anak yujiem tapi belom pernah naik tayo???,58,73,0
1798561586019434532,2024-06-06 03:44:32+00:00,https://x.com/UGM_FESS/status/1798561586019434532,UGM_FESS,"jahatin temen akuðŸ«µðŸ»)
- terbuka semua jurusan tp kalau bisa medika tp kalau ngga ya gapapaa ;)

Luv",0,0,0
1798561584803115266,2024-06-06 03:44:32+00:00,https://x.com/UGM_FESS/status/1798561584803115266,UGM_FESS,"HALOO AKU MAU WTS TEMEN (semua spek di bawah seuai testi ak)
- imo CANTIK
- kristen âœï¸
- medika 22
- perhatian, pintar tapi receh 
- borong semua love languangeee
- Minus: sering ujian

Looking for
- Cowo kristen jugaa
- would treat her as a goddess (awas aja kalo  (cont..)",2,4,0
1798560965610569963,2024-06-06 03:42:04+00:00,https://x.com/UGM_FESS/status/1798560965610569963,UGM_FESS,setuju ngga klo mba mba plat R tu lucu lucu yujiem,21,32,3
1798560211940278585,2024-06-06 03:39:04+00:00,https://x.com/UGM_FESS/status/1798560211940278585,UGM_FESS,"yujiem sarann dong barang apa yg berguna buat kkn terutama yg ciwi-ciei, mumpung 6.6 nih heheðŸ¥°",0,3,0
1798558713294590241,2024-06-06 03:33:07+00:00,https://x.com/UGM_FESS/status/1798558713294590241,UGM_FESS,"Ada yg mau temenin sender nugas ga? Atau habisin waktu bareng karena sender qtime tapi lgi kesepian. Like/komen aja ya, prefer cowo luv",5,0,0
1798558492560966051,2024-06-06 03:32:14+00:00,https://x.com/UGM_FESS/status/1798558492560966051,UGM_FESS,Ugm_fess saran tema besar untuk acara farewell party dong gais,0,0,0
1798558134111437113,2024-06-06 03:30:49+00:00,https://x.com/UGM_FESS/status/1798558134111437113,UGM_FESS,"knp ya aku apa apa bosen, nonton film bosen, baca buku bosen, jadi kalau gada kerjaan biasanya cuma main hpðŸ˜­ tapi kekk dulu nonton drakor suka bgt skrg engga, watching slump gt yujiem",2,0,0
1798557515770421662,2024-06-06 03:28:21+00:00,https://x.com/UGM_FESS/status/1798557515770421662,UGM_FESS,"yujiem! ada yang mau beli sunscreen azarine 45PA+ 50 mL, 50k aja belom aku buka. Dijual karna aku mau ganti sunscreenn",1,1,0
1798557218474004941,2024-06-06 03:27:11+00:00,https://x.com/UGM_FESS/status/1798557218474004941,UGM_FESS,ada yang tau ngga percetakan/print2an quantum itu di pogung sebelah mana ya ugm_fess,0,0,0
1798555368563552477,2024-06-06 03:19:50+00:00,https://x.com/UGM_FESS/status/1798555368563552477,UGM_FESS,mengutip jurnal itu boleh bagian latbelnya kita kutip atau temuan(pembahasan) nya aja sih yg boleh?? help yujiem!,0,0,0
1798554714906513750,2024-06-06 03:17:14+00:00,https://x.com/UGM_FESS/status/1798554714906513750,UGM_FESS,"ugm_fess gais aku juga butuh bantuan buat translate &amp; memahami jurnal international buat presentasi di dpn dosenðŸ¥¹ yg jago inggris dan selo hari ini reply ya, nanti tak gofudin makan siang wkwkðŸ˜­ðŸ‘",0,6,0
1798554522727678065,2024-06-06 03:16:28+00:00,https://x.com/UGM_FESS/status/1798554522727678065,UGM_FESS,"ugm_fess
guyss, ini kan aku minta tolong mbakku buat beresin kamar + kamar mandi, katanya bayar seikhlasnya. kalau aku bayar 50k tuh cukup atau kurang yaa untuk area jogja ini? maaci banyakk ðŸ™ðŸ¼",0,3,0
1798554183953727691,2024-06-06 03:15:07+00:00,https://x.com/UGM_FESS/status/1798554183953727691,UGM_FESS,ugm_fess yang pusing kkn mending kita mutualn gusy mari berbagi sambatan tim kkn kalianâ—â—â—â—like untuk bermutualan,16,0,0
1798553323911700773,2024-06-06 03:11:42+00:00,https://x.com/UGM_FESS/status/1798553323911700773,UGM_FESS,Ugm_fess rujak es krim depan FKH tuh berapaan ya guys?,0,1,0
1798552289533395047,2024-06-06 03:07:35+00:00,https://x.com/UGM_FESS/status/1798552289533395047,UGM_FESS,anak yujiem ada yang ke paripico besok sabtuuu PLISS sender butuh temen buat keliling2 cari merch ðŸ˜­ðŸ˜­ðŸ˜­ðŸ™,0,0,0
1798551870937702851,2024-06-06 03:05:56+00:00,https://x.com/UGM_FESS/status/1798551870937702851,UGM_FESS,"infonya dong angkatan 2022 yujiem! kalian besok abis uas liburan semester udah pada magang, cari kerja, atau turu?",21,25,0
1798551418368082196,2024-06-06 03:04:08+00:00,https://x.com/UGM_FESS/status/1798551418368082196,UGM_FESS,ugm_fess GUYS INFO KOS CEWE BUDGET 800 RIBU KALO BISA POGUNG KALO GABISA MANA AJA DEHHH TERSERAH HUHUHU ðŸ˜­ðŸ˜­ðŸ˜­ðŸ˜­ (desperate),5,8,0
1798549679896199584,2024-06-06 02:57:13+00:00,https://x.com/UGM_FESS/status/1798549679896199584,UGM_FESS,smoga jadi amal jariyah kalianðŸ˜­ðŸ™,0,0,0
1798549678696612166,2024-06-06 02:57:13+00:00,https://x.com/UGM_FESS/status/1798549678696612166,UGM_FESS,"ugm_fess halo anak sasing atau siapapun yg jago inggris, ada yg berkenan bantu aku translate &amp; memahami isi jurnal international? 
di translate malah jadi acak-acakan, udh seminggu nangis gara-gara tetep pahamðŸ˜­ plis bantu aku warga ugm nanti tak jajain deh, makasii  (cont..)",0,3,0
1798547157370446191,2024-06-06 02:47:12+00:00,https://x.com/UGM_FESS/status/1798547157370446191,UGM_FESS,"Yujiem hari ini langitnya cerah banget, jadi banyak banyak bersyukur",1,0,0
1798546052460781875,2024-06-06 02:42:48+00:00,https://x.com/UGM_FESS/status/1798546052460781875,UGM_FESS,ugm_fess info villa di jogja yg ada swimming pool + muat 40 orang,0,3,0
1798545616685191637,2024-06-06 02:41:05+00:00,https://x.com/UGM_FESS/status/1798545616685191637,UGM_FESS,warga yujiem kalo nyukur blu ketiak prefer pake apa yaðŸ˜” yg ga mahal,0,3,0
1798545363219177856,2024-06-06 02:40:04+00:00,https://x.com/UGM_FESS/status/1798545363219177856,UGM_FESS,PERMISII GUYSS URGENTT ada yg nemu stnk mobil di sekitar GSP dan perpusat ga yaa?? (dompet stnk warna coklat) makaasiii ugm_fess,0,0,0
1798545154363769181,2024-06-06 02:39:14+00:00,https://x.com/UGM_FESS/status/1798545154363769181,UGM_FESS,"gws untuk seluruh warga sem 6 yg mau terjun kkn for all of the struggles and dramas , buat komanit semua tim pls jangan tipes dulu sehat"" kalian semua ðŸ˜“ðŸ˜“ðŸ˜“ ugm_fess",71,1,5
1798545064391786730,2024-06-06 02:38:53+00:00,https://x.com/UGM_FESS/status/1798545064391786730,UGM_FESS,"Yujiem mo nanya, kalo sakit telinga periksa di gmc bayar ga ya gaiss?? Makasi",0,1,0
1798544620957360336,2024-06-06 02:37:07+00:00,https://x.com/UGM_FESS/status/1798544620957360336,UGM_FESS,ugm_fess kopi pujale tu warung yg sebelah mana gess ?,0,0,0
