tweet_id,time_created,url,username,text,likes,replies,retweets
1801946422742524121,2024-06-15 11:54:40+00:00,https://x.com/UGM_FESS/status/1801946422742524121,UGM_FESS,"Kalo skripsi udah oke, langsung cek Turnitin di Turned In aja ðŸƒðŸ’¨ 

Info nih, cek Turnitin di website Turned In udah no repository, 100% otomatis, bisa diakses 24 jam, &amp; GRATIS filter! ðŸ˜ŽðŸŒ¾

Langsung aja cek turnitin di https://t.co/nuc03dz4yV sekarang! ðŸ”¥

#TemanAkademikmu https://t.co/kQqK0dALEy",5,0,0
1801805263940501965,2024-06-15 02:33:45+00:00,https://x.com/UGM_FESS/status/1801805263940501965,UGM_FESS,Yujiem mending main honkai star rail atau honkai impact? Hp sender cuma bisa nambah 1 game dr 2 itu. Yg mana yg lebih seru sama bagus grafiknya?,11,29,0
1801769282084474926,2024-06-15 00:10:46+00:00,https://x.com/UGM_FESS/status/1801769282084474926,UGM_FESS,a gentle reminder ugm_fess https://t.co/JcRZKo8RHm,677,1,126
1801762193651994676,2024-06-14 23:42:36+00:00,https://x.com/UGM_FESS/status/1801762193651994676,UGM_FESS,adakah yg tahun lalu semigap di yujiem &amp; pindah prodi melalui utul? thank youuu,6,2,0
1801687369000829091,2024-06-14 18:45:17+00:00,https://x.com/UGM_FESS/status/1801687369000829091,UGM_FESS,Tapi gamau bayar full juga ðŸ˜­ðŸ™,0,0,0
1801687367784534262,2024-06-14 18:45:16+00:00,https://x.com/UGM_FESS/status/1801687367784534262,UGM_FESS,"Ugm_fess Ada yg mau nempatin kosku selama aku kkn gak yaa? Dari tgl 30 Juni - 19 Agt ajaa tapi. Harganya 750rb, di daerah Klebengan. Fasilitas udah ada listrik, wifi, km dalem, dapur. Tapi cukup di tanggal itu aja ðŸ˜­ Soalnya gamau aku lepas, udah enak banget. (cont)",3,14,0
1801685266601849270,2024-06-14 18:36:55+00:00,https://x.com/UGM_FESS/status/1801685266601849270,UGM_FESS,halo gaiiss saranin kosan putri dong di sekitar jakal/pogung/sekitar mipa yujiem yang km dalam dan max budget 1jtðŸ˜,1,5,0
1801661452455186783,2024-06-14 17:02:18+00:00,https://x.com/UGM_FESS/status/1801661452455186783,UGM_FESS,"yujiem rekomendasi printer yg bisa buat fotocopy sekalian merek apa dan di harga berapa ya? sender mau mulai nabung soalnya
makasih banyak",31,20,1
1801660455041253839,2024-06-14 16:58:20+00:00,https://x.com/UGM_FESS/status/1801660455041253839,UGM_FESS,Tolong jangan ngobrol keras keras di depan kosðŸ˜­ dah tengah malem woyðŸ˜­ yujiem!,24,8,4
1801659389558067661,2024-06-14 16:54:06+00:00,https://x.com/UGM_FESS/status/1801659389558067661,UGM_FESS,"ugm_fess haloo sender mau âœ¨ï¸PRELOVEDâœ¨ï¸ nih, liptint somethinc ombrella shade 09 noble, baru pemakaian 1x aja, alasan preloved karena salah shade, DIJUAL 40K AJAAHH (sender beli 47,2k), yang minat boleh reply yahh nanti sender ketuk dmnyaðŸ¤© thank youuâ€¼ï¸ https://t.co/iwXXo65ZVY",1,0,0
1801653865089241232,2024-06-14 16:32:09+00:00,https://x.com/UGM_FESS/status/1801653865089241232,UGM_FESS,yujiem kalian ada yang ju4l perintilan kpop gitu ngga,1,31,0
1801651368601784641,2024-06-14 16:22:13+00:00,https://x.com/UGM_FESS/status/1801651368601784641,UGM_FESS,luv pernah ga si lu ngincer kating eh malah yg kepincut adtingnya ðŸ’€,1,1,0
1801651337555493353,2024-06-14 16:22:06+00:00,https://x.com/UGM_FESS/status/1801651337555493353,UGM_FESS,ama fapet semangat belajar responsinya luv!,3,0,0
1801650438833639925,2024-06-14 16:18:32+00:00,https://x.com/UGM_FESS/status/1801650438833639925,UGM_FESS,yujiem kalian lagi pada ngapain ges? aku pusing mikir responsi ðŸ˜”,35,22,3
1801648279463334013,2024-06-14 16:09:57+00:00,https://x.com/UGM_FESS/status/1801648279463334013,UGM_FESS,"Luv kalo sender lolos pimnas, sender bakal confess ke temen pkm sender. Doakan ya ðŸ¤ðŸ»",80,34,1
1801641309339586998,2024-06-14 15:42:15+00:00,https://x.com/UGM_FESS/status/1801641309339586998,UGM_FESS,"yujiem ada yang jualan gifts lucu"" ga spesial uas?",0,1,0
1801638894527779214,2024-06-14 15:32:39+00:00,https://x.com/UGM_FESS/status/1801638894527779214,UGM_FESS,ugm_fess long time no see ^^,4,0,0
1801636666064650489,2024-06-14 15:23:48+00:00,https://x.com/UGM_FESS/status/1801636666064650489,UGM_FESS,yujiem yang lebaran ga pulkam mending ikut kelas make up ini sama gw mumpung masih buka registration sampe bsk subuh kata kakaknya https://t.co/1SODyWnh7X,1,0,1
1801632104096403950,2024-06-14 15:05:40+00:00,https://x.com/UGM_FESS/status/1801632104096403950,UGM_FESS,"ugm_fess infokan kontrakan area sayegan, ngemplak, or berbah",0,1,0
1801627122743882219,2024-06-14 14:45:53+00:00,https://x.com/UGM_FESS/status/1801627122743882219,UGM_FESS,luv! attila libera dah punya gebetan blm ya?,3,9,0
1801625952738492756,2024-06-14 14:41:14+00:00,https://x.com/UGM_FESS/status/1801625952738492756,UGM_FESS,"ugm_fess hi guyss, adakah yg mau bantu isi kuisioner penelitian tesisku, masih butuh 200 responden:) syaratnya pernah kirim laporan gempa bumi ""Saya juga merasakannya"" di aplikasi Info BMKG. nanti rep aja yaaa guys, aku kirim di dm, tolong yaa, makasi orang baikkðŸ«¶",3,4,0
1801625104859967905,2024-06-14 14:37:52+00:00,https://x.com/UGM_FESS/status/1801625104859967905,UGM_FESS,infokan nobar euro are yujiem dong,4,1,0
1801624501345730630,2024-06-14 14:35:28+00:00,https://x.com/UGM_FESS/status/1801624501345730630,UGM_FESS,"luv! ini ex crush ku semi gap nyusul aku di ugm mana sama2 jadi gamada, apa jangan2 kita jodoh ya, jd curiga.. (aamin in plis)",1,0,0
1801624362325578075,2024-06-14 14:34:55+00:00,https://x.com/UGM_FESS/status/1801624362325578075,UGM_FESS,"yujiem! ini anak peternakan lagi supporteran, kira-kira mas nya angkatan berapa ya? https://t.co/ZrAtvbK8yZ",323,57,10
1801622177948815493,2024-06-14 14:26:14+00:00,https://x.com/UGM_FESS/status/1801622177948815493,UGM_FESS,"ugm_fess Permisi teman-teman
Adakah yang punya info kosan cowo budget max 900 ribu?
tia",5,2,0
1801617006346781039,2024-06-14 14:05:41+00:00,https://x.com/UGM_FESS/status/1801617006346781039,UGM_FESS,"Berkah Alhamdulillah akhirnya gak macet lg ni jalan...
KEEP BOYCOTT GAIS ðŸ”¥
Yujiem https://t.co/IFTmXw6BDQ",2382,73,120
1801616731141771292,2024-06-14 14:04:35+00:00,https://x.com/UGM_FESS/status/1801616731141771292,UGM_FESS,"yujiem pls mau info kos putri di pogung/ sendowo/ sekitarnya, bebas isian/ kosongan, bebas km dalem/ luar jg yg penting bersih &amp; ada dapur bersama + kulkas. Budget 500-800k.",9,2,0
1801612850882113965,2024-06-14 13:49:10+00:00,https://x.com/UGM_FESS/status/1801612850882113965,UGM_FESS,ketik 1 jika kalian melihat menfess ini yujiem!,23,29,0
1801612192703463725,2024-06-14 13:46:33+00:00,https://x.com/UGM_FESS/status/1801612192703463725,UGM_FESS,"Agak telat dikit tp 
Mendarat di bumi UGM dengan selamat
Selamat datang maba yujiem 2024 (â â‰§â â–½â â‰¦â )â¤ï¸ https://t.co/aQvvWogdU3",146,6,0
1801609853477310524,2024-06-14 13:37:16+00:00,https://x.com/UGM_FESS/status/1801609853477310524,UGM_FESS,"GAISS JANGAN KIRIM FESS CUMA BUAT TES MENFESS

kalo kaya gitu limitnya bisa habis dalam 2 jam, nanti bs kirim lg nunggu 1x24 jam ðŸ˜ŠðŸ˜Š",8,0,0
1801609542939328605,2024-06-14 13:36:01+00:00,https://x.com/UGM_FESS/status/1801609542939328605,UGM_FESS,Tes masuk gak gaess nyoba cara bot baru yujiem!,0,2,0
1801608992252399847,2024-06-14 13:33:50+00:00,https://x.com/UGM_FESS/status/1801608992252399847,UGM_FESS,"Welcomee semua yang sudah berhasil masuk kampus gadjah mada inii! 

Selamat menikmati euforia gamada sebelum akhirnya kalian bertukar stiker ini awoakakaowok ugm_fess https://t.co/sd8NILQpRA",1231,28,142
1801608678623342726,2024-06-14 13:32:35+00:00,https://x.com/UGM_FESS/status/1801608678623342726,UGM_FESS,"Kalo skripsi udah oke, langsung cek Turnitin di Turned In aja ðŸƒðŸ’¨ 

Info nih, cek Turnitin di website Turned In udah no repository, 100% otomatis, bisa diakses 24 jam, &amp; GRATIS filter! ðŸ˜ŽðŸŒ¾

Langsung aja cek turnitin di https://t.co/nuc03dz4yV sekarang! ðŸ”¥

#TemanAkademikmu https://t.co/8olfphWJuI",4,0,0
1801608661607059718,2024-06-14 13:32:31+00:00,https://x.com/UGM_FESS/status/1801608661607059718,UGM_FESS,"luv aku sama ex ku udh lost contact sebulan yg lalu, dan kayaknya kmrn dia ga lolos utbk, mau chat kasih semangat tp agak gmn :""",2,3,0
1801608282022510752,2024-06-14 13:31:01+00:00,https://x.com/UGM_FESS/status/1801608282022510752,UGM_FESS,"yujiem rekomendasi sunscreen yan GEDE BANGET tapi harganya masih masuk akal dongg, mau buat kkn nih",13,4,0
1801606856202457449,2024-06-14 13:25:21+00:00,https://x.com/UGM_FESS/status/1801606856202457449,UGM_FESS,"ugm_fess Halo guys, info kosan putri isian (ac+km dalam) yg ga jauh dari sv donggg â˜ï¸ðŸ˜ max budget 1.1 yaaaa. TI@ ðŸ™",31,31,2
1801605925477982437,2024-06-14 13:21:39+00:00,https://x.com/UGM_FESS/status/1801605925477982437,UGM_FESS,"halo warga yujiem ak lg nyobain bot baru, rekomen makan malem di shopeefood dong thxxxxx all",5,4,0
1801605430088765717,2024-06-14 13:19:41+00:00,https://x.com/UGM_FESS/status/1801605430088765717,UGM_FESS,ugm_fess ini yg lebaran ga pulang gamau bikin acara gt??,0,2,0
1801605180468957435,2024-06-14 13:18:41+00:00,https://x.com/UGM_FESS/status/1801605180468957435,UGM_FESS,yujiem kalian pulang ga idul adha,47,124,0
1801603647685431771,2024-06-14 13:12:36+00:00,https://x.com/UGM_FESS/status/1801603647685431771,UGM_FESS,"LINK KIRIM MENFESS:

https://t.co/giU4Ik5YsD

Silahkan dipakai yaa! Sudah tidak perlu kirim fess hanya untuk tes, thankyouu",165,4,19
1801602806799024434,2024-06-14 13:09:15+00:00,https://x.com/UGM_FESS/status/1801602806799024434,UGM_FESS,ayo semangat semua yujiem bentar lagi kita libur ðŸ˜Š,46,12,20
1801602717321990202,2024-06-14 13:08:54+00:00,https://x.com/UGM_FESS/status/1801602717321990202,UGM_FESS,yujiem halo guys sender lagi nyoba bot baru hehehe,0,0,0
1801600614683787711,2024-06-14 13:00:33+00:00,https://x.com/UGM_FESS/status/1801600614683787711,UGM_FESS,yujiem Cek halo ini coba lewat xbot,0,0,0
1801600003246592311,2024-06-14 12:58:07+00:00,https://x.com/UGM_FESS/status/1801600003246592311,UGM_FESS,"Woooo haloooooo, mau bantu mimin ugm_fess cobain inii",1,0,0
1801599887412445327,2024-06-14 12:57:39+00:00,https://x.com/UGM_FESS/status/1801599887412445327,UGM_FESS,yujiem selamat malam selamat uas cek bot,3,0,0
1801599055732346955,2024-06-14 12:54:21+00:00,https://x.com/UGM_FESS/status/1801599055732346955,UGM_FESS,yujiem ada yang ikut career counselingnya AVO? itu tuh kita bisa konsultasi secara umum apa cuma yang berhubungan buat kerja di AVO deh,1,0,0
1801598613258440881,2024-06-14 12:52:36+00:00,https://x.com/UGM_FESS/status/1801598613258440881,UGM_FESS,"yujiem guyss ada yang bisa bantu isi kuesionerku ngga pliss masi butuh banyak huhu...
kriterianya:

1. Usia 17-21
2. Domisili DIY
3. Pernah menonton konten fashion TikTok
nanti aku dm yaaa, terimakasii",1,4,0
1801597617287401525,2024-06-14 12:48:38+00:00,https://x.com/UGM_FESS/status/1801597617287401525,UGM_FESS,Ramaikan lagi ugm_fess sender kangen pliss,11,5,0
1801597181016887657,2024-06-14 12:46:54+00:00,https://x.com/UGM_FESS/status/1801597181016887657,UGM_FESS,yujiem dimana tempat ngejual hp batangan? box nya ketinggalan di rumah,3,9,0
1801596807769952420,2024-06-14 12:45:25+00:00,https://x.com/UGM_FESS/status/1801596807769952420,UGM_FESS,ugm_fess urgent!! ada yg liat STNK Deket perpusat atau pandega ga ya,1,0,0
1801596145631957032,2024-06-14 12:42:47+00:00,https://x.com/UGM_FESS/status/1801596145631957032,UGM_FESS,Yujiem! tes percobaan kirim menfess via xbot mungkin berhasil aamiin bismillah,2,0,0
1801595942724112666,2024-06-14 12:41:59+00:00,https://x.com/UGM_FESS/status/1801595942724112666,UGM_FESS,@teriksandikala cek dm kaak,0,0,0
1801595486107013156,2024-06-14 12:40:10+00:00,https://x.com/UGM_FESS/status/1801595486107013156,UGM_FESS,Yujiem sender masih prefer main di x drpd akun sebelah. Kalian dah aktif di sebelah? Di birulangit,4,6,0
1801594453091881278,2024-06-14 12:36:04+00:00,https://x.com/UGM_FESS/status/1801594453091881278,UGM_FESS,"âœ¨CARI CAPING DIMANA YA?âœ¨

Halo Gamada! Pionir makin deket nih!!

buat para Gamada yang bingung cari caping dimana, CANGCIPING menyediakan caping anti revisi! Tenang aja, kamu bisa request warna caping kok ðŸ˜‹ mulai dari 20k aja ðŸ¤©

â€¼ï¸Follow our socmedðŸ˜»â€¼ï¸
IG &amp; X: @cangciping https://t.co/R7vqocIMmG",170,19,9
1801591140149563487,2024-06-14 12:22:54+00:00,https://x.com/UGM_FESS/status/1801591140149563487,UGM_FESS,ugm_fess hai gais lagi pada ngapain kangen ga sih di base X,19,9,0
1801585569224658994,2024-06-14 12:00:46+00:00,https://x.com/UGM_FESS/status/1801585569224658994,UGM_FESS,cont.. https://t.co/FXEnlYxKWU,0,0,0
1801585539419934731,2024-06-14 12:00:39+00:00,https://x.com/UGM_FESS/status/1801585539419934731,UGM_FESS,"Halo Gadjah Mada Muda 2024! 
.
Ga sempet buat atribut? 
Tenang aja, disini kita sedia semua atribut yg kalian perlukan
.
Selain atribut, kita juga menyediakan merchandise
Ga usah ribet2 bikin, tinggal order aja. Semua atribut sesuai dengan ketentuan dan ada garansi 100%!! 
.
Ayo buruan order, early bird cuma sampai 30 juni. 
Pembayaran dapat melalui:
1404605966 BNI a.n. Sydney Ilma Zees
Shopeepay/Dana 082137556161

hubungi: 
https://t.co/kOxzgsAUVt
https://t.co/u8yHCkZT2G

_______
Brought to you by: UGM MERCH
https://t.co/HoRFMqGMA3",23,3,1
1801391496786284663,2024-06-13 23:09:35+00:00,https://x.com/UGM_FESS/status/1801391496786284663,UGM_FESS,"@_bbatuan gaada ka, diatas limit itu kalo ga salah bayarnya sekitar $5000 alias 80 jutaan per bulan ðŸ¤£ðŸ¤£",1,0,0
1801265683646558490,2024-06-13 14:49:39+00:00,https://x.com/UGM_FESS/status/1801265683646558490,UGM_FESS,"GAISSS BEGINI YAH

Bot ugm yg di X tetap jalan dengan limit 50/hari. Fyi aja, dalam keadaan normal base ugm itu sehari 300 tweet/hari.

Jadi mohon dengan amat sangat, jangan kirim menfess kalau cuma ""cek cek"" ""tes tes"" jangan sia siakan limit itu ðŸ˜ŠðŸ˜Šâ˜ï¸

base tetap migrasi ke bluesky. Disini sifatnya rebutan.",94,2,2
1801264556913594492,2024-06-13 14:45:10+00:00,https://x.com/UGM_FESS/status/1801264556913594492,UGM_FESS,"@kembaran_apis hoo nice info, satu satu ya kak, info lain menyusul",0,1,0
1801262233357529172,2024-06-13 14:35:56+00:00,https://x.com/UGM_FESS/status/1801262233357529172,UGM_FESS,@kembaran_apis yg bayar siapa,1,1,0
1801258790970605973,2024-06-13 14:22:16+00:00,https://x.com/UGM_FESS/status/1801258790970605973,UGM_FESS,eh wkwkwkkw ini dr jasa botnya yg ngetweet ðŸ˜­ðŸ¤£,12,1,0
1801243206497218583,2024-06-13 13:20:20+00:00,https://x.com/UGM_FESS/status/1801243206497218583,UGM_FESS,"anywayy, 

WELCOME GAMADA 24 JALUR SNBT ðŸ¤©ðŸ¤©ðŸ¤©",332,40,44
1801242925776699559,2024-06-13 13:19:13+00:00,https://x.com/UGM_FESS/status/1801242925776699559,UGM_FESS,thanks @devxhop udah bantu aktifin autobase kami,47,9,1
1801225524947399007,2024-06-13 12:10:04+00:00,https://x.com/UGM_FESS/status/1801225524947399007,UGM_FESS,"Kalo skripsi udah oke, langsung cek Turnitin di Turned In aja ðŸƒðŸ’¨ 

Info nih, cek Turnitin di website Turned In udah no repository, 100% otomatis, bisa diakses 24 jam, &amp; GRATIS filter! ðŸ˜ŽðŸŒ¾

Langsung aja cek turnitin di https://t.co/nuc03dz4yV sekarang! ðŸ”¥

#TemanAkademikmu https://t.co/C4O5E2FDKX",11,1,2
1801224641929007270,2024-06-13 12:06:34+00:00,https://x.com/UGM_FESS/status/1801224641929007270,UGM_FESS,"Teman-teman, berhubung hingga saat ini kami masih menanggung beberapa biaya operasional yakni bot di X, bot di bluesky, serta verified account di X. Paid promote yang telah di booked sebelumnya masih tetap berjalan. 

Hal ini diperlukan karena saat ini kami masih menutup paid promote supaya sounding migrasi ke bluesky tidak tertutup tweet lainnya.

Mohon pengertiannya ya teman-teman, terimakasih banyak ! ðŸ™‡â€â™€ï¸ðŸ™‡â€â™€ï¸ðŸ™‡â€â™€ï¸",13,0,0
1801223508057551057,2024-06-13 12:02:04+00:00,https://x.com/UGM_FESS/status/1801223508057551057,UGM_FESS,"Halo Gadjah Mada Muda 2024! 
.
Ga sempet buat atribut? 
Tenang aja, disini kita sedia semua atribut yg kalian perlukan
.
Selain atribut, kita juga menyediakan merchandise
Ga usah ribet2 bikin, tinggal order aja. Semua atribut sesuai dengan ketentuan dan ada garansi 100%!! 
.
Ayo buruan order, early bird cuma sampai 30 juni. 
Pembayaran dapat melalui:
1404605966 BNI a.n. Sydney Ilma Zees
Shopeepay/Dana 082137556161

hubungi: 
https://t.co/kOxzgsAUVt
https://t.co/u8yHCkZT2G

_______
Brought to you by: UGM MERCH
https://t.co/HoRFMqGMA3",133,10,9
1801172825274826787,2024-06-13 08:40:40+00:00,https://x.com/UGM_FESS/status/1801172825274826787,UGM_FESS,"âœ¨CARI CAPING DIMANA YA?âœ¨

Halo Gamada! Pionir makin deket nih!!

buat para Gamada yang bingung cari caping dimana, CANGCIPING menyediakan caping anti revisi! Tenang aja, kamu bisa request warna caping kok ðŸ˜‹ mulai dari 20k aja ðŸ¤©

â€¼ï¸Follow our socmedðŸ˜»â€¼ï¸
IG &amp; X: @cangciping https://t.co/VK9WLnzVsy",39,4,2
1801137596741066962,2024-06-13 06:20:41+00:00,https://x.com/UGM_FESS/status/1801137596741066962,UGM_FESS,"Betul, cari tweet ini yaa di bluesky. Nanti direply aja disana. 

Untuk saat ini masih open DM, jadi siapapun bisa kirim fess tanpa harus di follback. https://t.co/JhQHjcN330",43,1,2
1801110847651189230,2024-06-13 04:34:23+00:00,https://x.com/microcosmostaaa/status/1801110847651189230,microcosmostaaa,@UGM_FESS Minn apakah yg udah di follow di x akan di follow juga di bluesky?,3,2,0
1801137317446595006,2024-06-13 06:19:34+00:00,https://x.com/UGM_FESS/status/1801137317446595006,UGM_FESS,"emang lg proses di biolbe yaa teman2, tp ya itu kapasitasnya di 50 tweet/hari, ga memenuhi kebutuhan base, soalnya biasanya sehari nyampe 300 tweet",9,1,0
1801106309733101644,2024-06-13 04:16:21+00:00,https://x.com/UGM_FESS/status/1801106309733101644,UGM_FESS,"Selamat pagi teman teman UGM_FESS!

Dengan berat hati kami mengumumkan per tanggal 13 Juni 2024, akun base UGM_FESS resmi pindah ke Bluesky dengan username yujiemfess. Alasannya karena bot yang tersedia di X tidak mumpuni untuk pengiriman menfess ke akun X.

Kami paham sebagian besar teman-teman mungkin sudah merasa sangat nyaman untuk pengiriman menfess melalui akun ini, sehingga kami juga masih mengusahakan tetap menggunakan layanan bot lain yang terbatas (50 tweet/hari) untuk akun ini. Tapi untuk saat ini masih dalam proses pengaktifan botnya.

Teman-teman yang butuh informasi cepat bisa membuat tweet di komunitas yang sudah kami sediakan. Atau langsung kirimkan saja menfess di base yujiemfess melalui bluesky.

Kalau teman-teman memiliki kritik dan saran bisa disampaikan karena saran dari teman teman akan kami pertimbangkan.

Terimakasih untuk 4 tahun yang sangat menyenangkan! Kedepannya base UGM_FESS di X akan diusahakan berjalan meskipun dengan amat terbatas, versi lengkapnya langsung di melalui bluesky ya! ðŸ˜¸ðŸ«¶

Salam hangat,
Admin UGM_FESS",1194,69,62
1800888957078843799,2024-06-12 13:52:40+00:00,https://x.com/UGM_FESS/status/1800888957078843799,UGM_FESS,Kalian udah punya akun bluesky belum?,0,5,0
1800877299191173190,2024-06-12 13:06:21+00:00,https://x.com/UGM_FESS/status/1800877299191173190,UGM_FESS,"KAMU LAGI CARI TRAINING LABORATORIUM BERSERTIFIKAT BUAT NAIKIN VALUE SKILL DAN CV???

ðŸš¨2 TRAINING MICROBIOLOGY DARI 250RIBU JADI 85RIBU DI TEMANLABðŸš¨

Kamu bakal dapat 2 training ini:
1. Training Analisa Pengujian Mikrobiologi
2. Training Microbiology Risk Assesment

Daftar di sini  https://t.co/joxhYpWUTT 

Belajar langsung dengan para praktisi yang relevan di bidangnya

Tambahan diskon 10% dengan join affiliate TemanLab https://t.co/cT38NyWeaQ

Gasss daftar sekarang juga sebelum promonya habis",31,0,0
1800857068683067794,2024-06-12 11:45:58+00:00,https://x.com/UGM_FESS/status/1800857068683067794,UGM_FESS,"Ga expect naik Gocar pake fitur Gocar Hemat cuma 5 ribu??!!! Enak bgt ini mah, udh ga kepanasan, cuma bayar 5 ribu. Andalan banget ðŸ˜«ðŸ‘ðŸ» https://t.co/hBYpLD8pzK",47,13,0
1800795974341898549,2024-06-12 07:43:12+00:00,https://x.com/UGM_FESS/status/1800795974341898549,UGM_FESS,"Sekarang bisa ramein antara di bsky atau di komunitas dulu yaa!

 https://t.co/6xDRzq1b3r",15,0,0
1800740397490356558,2024-06-12 04:02:21+00:00,https://x.com/UGM_FESS/status/1800740397490356558,UGM_FESS,"@fuvkumakehurt wkwkwk gapapa kak, yg di X pake community dulu. Sementara nanti yg disini pelan2 menfessnya jg dicari jalan keluarnya yaah",3,0,0
1800739912444256380,2024-06-12 04:00:25+00:00,https://x.com/UGM_FESS/status/1800739912444256380,UGM_FESS,"@mdbster_ engga ka gapapa wkwkwk aman, itu bakal di open DM dulu biar enak dan ramein base duluu",1,0,0
1800737271475478710,2024-06-12 03:49:56+00:00,https://x.com/UGM_FESS/status/1800737271475478710,UGM_FESS,@helmi_stbd makasih kakkk,0,0,0
1800736568388583467,2024-06-12 03:47:08+00:00,https://x.com/UGM_FESS/status/1800736568388583467,UGM_FESS,"Bluesky saat ini admin buat open DM ya, jd semua bisa kirim fess. Terus buat yang mau difollback syaratnya sudah difollback di base ini.

Reply di tweet itu yaa gaiss thankyouu https://t.co/jlAfUldeQA",82,12,2
1800730424903442790,2024-06-12 03:22:43+00:00,https://x.com/UGM_FESS/status/1800730424903442790,UGM_FESS,yang udah start di bluesky dan ketaut di telegram coba kirim menfess dong gaiss buat tes pada berhasil atau enggaa? https://t.co/Tp0KPGrsjz,89,9,3
1800709730182267328,2024-06-12 02:00:29+00:00,https://x.com/UGM_FESS/status/1800709730182267328,UGM_FESS,"Gais yang pernah edit2 logo simaster lucu boleh reply dong, mau izin dipake buat foto profile. Ada feenya yak aman ðŸ˜‰",25,6,1
1800700391757394164,2024-06-12 01:23:23+00:00,https://x.com/UGM_FESS/status/1800700391757394164,UGM_FESS,"Polling sername Bsky

(ugmfess udah gabisa soalnya dipake orang lain)",4,2,0
1801242925776699559,2024-06-13 13:19:13+00:00,https://x.com/UGM_FESS/status/1801242925776699559,UGM_FESS,thanks @devxhop udah bantu aktifin autobase kami,47,9,1
1800699009465770382,2024-06-12 01:17:53+00:00,https://x.com/UGM_FESS/status/1800699009465770382,UGM_FESS,"@hxnwritten @ayaanjelain thankss ka, sudah dicek dia pake biolbe dengan limit 50 juga ðŸ˜ž",0,0,0
1800698643076550920,2024-06-12 01:16:26+00:00,https://x.com/UGM_FESS/status/1800698643076550920,UGM_FESS,@ccmoru @nanaue_ balikin gk,0,1,0
1800694601738826004,2024-06-12 01:00:22+00:00,https://x.com/UGM_FESS/status/1800694601738826004,UGM_FESS,"Ini bukan admin yah yg bikin, kayanya akan tetep coba buka akun disini jg soalnya admin dah terlanjur bayar sampai taun depan buat jasa bot yg di tele sebelumnya ðŸ¤£ðŸ˜­

tunggu info resmi dr syâ˜ï¸â˜ï¸ https://t.co/gIxbAGATIK",116,2,1
1800684135108980736,2024-06-12 00:18:47+00:00,https://x.com/UGM_FESS/status/1800684135108980736,UGM_FESS,"ðŸš¨ðŸš¨NINU NINU NINUðŸš¨ðŸš¨

Untuk sementara waktu akan begini yaa :

1. Bot off total, baik pengiriman dari telegram ataupun DM

2. Komunitas sudah ON ya, masih percobaan nanti akan dirapihkan bertahap

3. Admin akan coba migrasi ke bot lain, masih ada yang bisa tapi terbatas 50fess/hari (dikit bgt tp at least we try yaðŸ¤£)

4. Paid promote yang kemarin booked akan tetap diposting, kalau tidak berkenan boleh ajuin refund dm @MiminUGMFESS 

5. Migrasi ke bluesky masih dipikir2 soalnya ribet kalau harus urus dua akun

6. Kalau semisal ga migrasi ke bluesky, orang2 yang daftar member premium bisa dm admin dengan mencantumkan bukti screenshoot nanti dikasih follback

Thank uu! sementara gini dulu yaa!",119,2,2
1800680622341730645,2024-06-12 00:04:50+00:00,https://x.com/UGM_FESS/status/1800680622341730645,UGM_FESS,Coba kalian tweet dong fren,43,51,1
1800677903463805404,2024-06-11 23:54:01+00:00,https://x.com/UGM_FESS/status/1800677903463805404,UGM_FESS,Test Test,46,0,0
1800576696690823564,2024-06-11 17:11:52+00:00,https://x.com/UGM_FESS/status/1800576696690823564,UGM_FESS,usulin nama komunitas dong guiz,14,24,1
1800568332728582168,2024-06-11 16:38:38+00:00,https://x.com/UGM_FESS/status/1800568332728582168,UGM_FESS,"@Jumarhadinata ooh dah ada yg curi start kah, admin blm sempet. cek soalnyaa",2,1,0
1800559604096811236,2024-06-11 16:03:57+00:00,https://x.com/UGM_FESS/status/1800559604096811236,UGM_FESS,"@ayaanjelain itu tp blm tentu aman dr suspend jg kak. dia maksimal sehari 50 tweet, jadi per jam cuma dua tweet paling yg kekirim, dulu base awalnya pake itu jugak",0,1,0
1800554150775902684,2024-06-11 15:42:16+00:00,https://x.com/UGM_FESS/status/1800554150775902684,UGM_FESS,"Mending apa ya gais,
1. Bikin community
2. Migrasi bluesky
3. Kirim menfess manual
4. Jual aja akunnya ðŸ¤‘ðŸ¤‘

Maaf yah terutama yg bayar member pemium, karena bot fix mati, jadi kalo mau lanjut ya di bluesky itu.. tp admin blm bikin jg ðŸ« ",239,77,0
1800553097284211123,2024-06-11 15:38:05+00:00,https://x.com/UGM_FESS/status/1800553097284211123,UGM_FESS,@anaknyaabahhh aku jg gatau WKWKWKWK ðŸ˜­ðŸ¤£,1,2,0
1800539948501827893,2024-06-11 14:45:50+00:00,https://x.com/UGM_FESS/status/1800539948501827893,UGM_FESS,"admin jg males sih, jadi opsinya botnya mati WKWKWKWK gk kuat ges kalo kirim manual",71,20,1
1800470022562918731,2024-06-11 10:07:59+00:00,https://x.com/UGM_FESS/status/1800470022562918731,UGM_FESS,gais kalo pindah ke bluesky gimana? kayanya bot bakal off total,117,79,1
1800501612613660750,2024-06-11 12:13:30+00:00,https://x.com/UGM_FESS/status/1800501612613660750,UGM_FESS,"Bingung dan Butuh Bimbingan untuk Penelitianmu?
Kami hadir untuk membantu!  

Klik link di bio IG @bridgeriset
Consultant dari Universitas Ternama
Free 100+ E-Book

Raih Gelarmu tanpa JOKI ! https://t.co/zNbbqAfTH7",30,0,1
1800446986187116610,2024-06-11 08:36:26+00:00,https://x.com/UGM_FESS/status/1800446986187116610,UGM_FESS,wkwkwkkw bot error. off yah,5,1,0
